WORK,SENT.ADDR,PARENT,PARENTH,FULL.PARENTH,LENGTH,ENIM,NAM,SENT
Att,/proiel/cic-att.xml|77969,,me hercule,me hercule,1,0,0,reliquum est ut ante quam proficiscare mandata nostra exhaurias scribas ad me omnia Pomptinum extrudas cum profectus eris cures ut sciam sic habeas nihil me hercule te mihi ne c carius esse ne c suavius 
Att,/proiel/cic-att.xml|77985,,credo,credo,1,0,0,in quo illum agentem aliquid credo salutavi
Att,/proiel/cic-att.xml|85707,,praetermissum,nihil enim praetermissum est,4,1,0,nam ne c quod mandem habeo nihil enim praetermissum est ne c quod narrem novi enim nihil ne c iocandi locus est  
Att,/proiel/cic-att.xml|85707,,,novi enim nihil ,3,1,0,nam ne c quod mandem habeo nihil enim praetermissum est ne c quod narrem novi enim nihil ne c iocandi locus est  
Att,/proiel/cic-att.xml|78071,,puto,vix enim puto,3,1,0,tu si modo es Romae vix enim puto sin es hoc vehementer animadvertas velim
Att,/proiel/cic-att.xml|78088,,quaeso,quaeso,1,0,0,tu quaeso quid agas ubi quoque tempore futurus sis qualis res nostras Romae reliqueris maxime de XX et DCCC cura ut sciamus 
Att,/proiel/cic-att.xml|78094,,me hercule,me hercule,1,0,0,Dionysium semper equidem ut scis dilexi sed cotidie pluris facio et me hercule in primis quod te amat ne c tui mentionem intermitti sinit 
Att,/proiel/cic-att.xml|78096,,crede,crede mihi,2,0,0,eram autem totus crede mihi te cum et quamquam sine iis per me ipse tamen acrius vestigiis tuis monitus de te cogitabam 
Att,/proiel/cic-att.xml|78098,,me hercule,me hercule,1,0,0,non me hercule alius ullus sermo nisi de te 
Att,/proiel/cic-att.xml|78109,,rem,rem minime aptam meis moribus,5,0,0,o rem minime aptam meis moribus
Att,/proiel/cic-att.xml|78117,,hercule,hercule,1,0,0,nec hercule umquam tam diu ignarus rerum mearum fui quid de Caesaris quid de Milonis nominibus actum sit  
Att,/proiel/cic-att.xml|78124,,hui,hui,1,0,0,hui totiens ne me litteras dedisse Romam cum ad te nullas darem 
Att,/proiel/cic-att.xml|78126,,per,per fortunas,2,0,0,ne provincia nobis prorogetur per fortunas dum ades quicquid provideri poterit provide
Att,/proiel/cic-att.xml|78142,,me hercule,me hercule,1,0,0,nos adhuc iter per Graeciam summa cum admiratione fecimus ne c me hercule habeo quod adhuc quem accusem meorum
Att,/proiel/cic-att.xml|78154,,hercule,hercule,1,0,0,apud Patronem et reliquos barones te in maxima gratia posui et hercule merito tuo feci
Att,/proiel/cic-att.xml|78174,,,id ipsum consilium nostrum ,4,0,0,de Messalla ad te statim ut audivi de Gyaro dedi litteras et id ipsum consilium nostrum etiam ad Hortensium cui quidem valde  
Att,/proiel/cic-att.xml|78175,,me hercule,me hercule,1,0,0,sed tuas de eius iudici sermonibus et me hercule omni de rei publicae statu litteras exspecto  quidem scriptas quoniam meos cum Thallumeto nostro pervolutas libros eius modi inquam litteras ex quibus ego non quid fiat nam id vel Helonius vir gravissimus potest efficere cliens tuus sed quid futurum sit sciam
Att,/proiel/cic-att.xml|78175,,potest,nam id vel helonius vir gravissimus potest efficere cliens tuus,10,0,1,sed tuas de eius iudici sermonibus et me hercule omni de rei publicae statu litteras exspecto  quidem scriptas quoniam meos cum Thallumeto nostro pervolutas libros eius modi inquam litteras ex quibus ego non quid fiat nam id vel Helonius vir gravissimus potest efficere cliens tuus sed quid futurum sit sciam
Att,/proiel/cic-att.xml|78178,,amabo,amabo te,2,0,0,nostra autem negotia quoniam Romae commoraris amabo te explica
Att,/proiel/cic-att.xml|78196,,per,per fortunas,2,0,0,per fortunas quoniam Romae manes primum illud praefulci atque praemuni quaeso ut simus annui ne intercaletur quidem 
Att,/proiel/cic-att.xml|78196,,quaeso,quaeso,1,0,0,per fortunas quoniam Romae manes primum illud praefulci atque praemuni quaeso ut simus annui ne intercaletur quidem 
Att,/proiel/cic-att.xml|78249,,me hercule,me hercule,1,0,0,me hercule etiam adventu nostro reviviscunt
Att,/proiel/cic-att.xml|78268,,amabo,amabo te,2,0,0,amabo te incumbe in eam rem et ad me scribe quid et possit et tu censeas
Att,/proiel/cic-att.xml|78311,,hui,hui,1,0,0,obsignaram iam epistulam eam quam puto te modo perlegisse scriptam mea manu in qua omnia continentur cum subito Apellae tabellarius a d xi Kal Octobris septimo quadragesimo die Roma celeriter hui tam longe mihi tuas litteras reddidit   
Att,/proiel/cic-att.xml|78311,,,tam longe ,2,0,0,obsignaram iam epistulam eam quam puto te modo perlegisse scriptam mea manu in qua omnia continentur cum subito Apellae tabellarius a d xi Kal Octobris septimo quadragesimo die Roma celeriter hui tam longe mihi tuas litteras reddidit   
Att,/proiel/cic-att.xml|78324,,malum,malum,1,0,0,qui malum 
Att,/proiel/cic-att.xml|78353,,scis,scis enim dici quaedam  dici item     ,11,1,0,interim scis enim dici quaedam  dici item     rumore adventus nostri et Cassio qui Antiochia tenebatur animus accessit et Parthis timor iniectus est 
Att,/proiel/cic-att.xml|85812,,credo,credo,1,0,0,credo voluit appellatione hac inani nobis esse par
Att,/proiel/cic-att.xml|78423,,erit,tibi ut video et spero nulla ad decedendum erit mora,10,0,0,etsi bellum  habet illa tua epistula quam dedisti nauseans Buthroto tibi ut video et spero nulla ad decedendum erit mora mallem ut video
Att,/proiel/cic-att.xml|78434,,me hercule,me hercule,1,0,0,nos enim et nostra sponte bene firmi et me hercule auctoritate tua inflammati vicimus omnis hoc tu ita reperies cum abstinentia tum iustitia facilitate clementia 
Att,/proiel/cic-att.xml|78434,,reperies,hoc tu ita reperies,4,0,0,nos enim et nostra sponte bene firmi et me hercule auctoritate tua inflammati vicimus omnis hoc tu ita reperies cum abstinentia tum iustitia facilitate clementia 
Att,/proiel/cic-att.xml|78436,,accepit,praeter eum semel nemo accepit,5,0,0,is ceteroqui abstinens sed Iulia lege transitans semel tamen in diem non ut alii solebant omnibus vicis praeter eum semel nemo accepit facit ut mihi excipiendus sit cum terruncium nego sumptus factum 
Att,/proiel/cic-att.xml|78441,,me hercule,me hercule,1,0,0,ipse in Asiam profectus sum Tarso Nonis Ianuariis non me hercule dici potest qua admiratione Ciliciae civitatum maxime que Tarsensium
Att,/proiel/cic-att.xml|85834,,loquor,non  sed verissime loquor,5,0,0,qua ex insula non  sed verissime loquor nummus nullus me obtinente erogabitur
Att,/proiel/cic-att.xml|78448,,fuerat,messis enim nulla fuerat,4,1,0,iter igitur ita per Asiam feci ut etiam fames qua nihil miserius est quae tum erat in hac mea Asia messis enim nulla fuerat mihi optanda fuerit
Att,/proiel/cic-att.xml|85837,,dispiciam,tum phemio dispiciam ,4,0,0,ex IdibusMartiis ibidem Synnadense Pamphylium tum Phemio dispiciam  Lycaonium Isauricum  
Att,/proiel/cic-att.xml|78510,,puto,puto,1,0,0,sed avunculo eius certe probabitur praesertim cum senatus consultum modo factum sit puto postquam tu es profectus in creditorum causa ut centesimae perpetuo faenore ducerentur
Att,/proiel/cic-att.xml|78527,,postulas,sic enim postulas,3,1,0,iis igitur respondebo non   sic enim postulas ne c  meam instituam sed ordinem conservabo tuum
Att,/proiel/cic-att.xml|78541,,me hercule,me hercule,1,0,0,nunc autem domus me hercule nulla tanto consilio aut tanta disciplina gubernatur aut tam modesta est quam nostra tota provincia
Att,/proiel/cic-att.xml|78560,,me hercule,me hercule,1,0,0,et me hercule ego ita iudico nihil illo regno spoliatius nihil rege egentius   
Att,/proiel/cic-att.xml|78588,,credo,credo,1,0,0,sit sane quoniam ita tu vis sed tamen cum eo credo quod sine peccato meo fiat 
Att,/proiel/cic-att.xml|78599,,loquitur,is enim loquitur,3,1,0,nec vero pauci sunt auctores Gnaium Flavium scribam fastos protulisse actiones que composuisse ne me hoc vel potius Africanum is enim loquitur commentum putes
Att,/proiel/cic-att.xml|78607,,credo,credo,1,0,0,qua re adiunges Saufeium nostrum hominem semper amantem mei nunc credo eo magis quod debet etiam fratris Appi amorem erga me cum reliqua hereditate crevisse 
Att,/proiel/cic-att.xml|78631,,heus,heus,1,0,0,sed heus tu quid cogitas
Att,/proiel/cic-att.xml|78662,,credo,credo,1,0,0,vestri enim credo gravis habent Turpionem sutorium et Vettium mancipem
Att,/proiel/cic-att.xml|78673,,πραγμάτων,  ,3,0,0,de statua Africani    sed me id ipsum delectavit in tuis litteris ai n tu
Att,/proiel/cic-att.xml|78673,,delectavit,sed me id ipsum delectavit in tuis litteris,8,0,0,de statua Africani    sed me id ipsum delectavit in tuis litteris ai n tu
Att,/proiel/cic-att.xml|78678,,me hercule,me hercule,1,0,0,at me hercule ego cum in turma inauratarum equestrium quas hic Metellus in Capitolio posuit animadvertissem in Serapionis subscriptione Africani imaginem erratum fabrile putavi 
Att,/proiel/cic-att.xml|78679,,ἀνιστορησίαν, turpem,2,0,0,o  turpem
Att,/proiel/cic-att.xml|78709,,ecce,ecce,1,0,0,ecce autem alia pusilla epistula quam non relinquam  
Att,/proiel/cic-att.xml|78717,,sciemus,iam enim sciemus de rebus urbanis de provinciis quae omnia in mensem martium sunt conlata ,15,1,0,tu velim dum ero Laodiceae id est ad Idus Maias quam saepissime me cum per litteras colloquare et cum Athenas veneris iam enim sciemus de rebus urbanis de provinciis quae omnia in mensem Martium sunt conlata utique ad me tabellarios mittas 
Att,/proiel/cic-att.xml|79029,,hercule,hercule,1,0,0,spero enim quae tua prudentia et temperantia est et hercule ut me iubet Acastus confido te iam ut volumus valere
Att,/proiel/cic-att.xml|79032,,me,me,1,0,0,hanc quae me hercule mihi magno dolori est dilexi enim hominem procura quantulacumque est Precianam hereditatem prorsus ille ne attingat
Att,/proiel/cic-att.xml|79032,,hercule,hercule,1,0,0,hanc quae me hercule mihi magno dolori est dilexi enim hominem procura quantulacumque est Precianam hereditatem prorsus ille ne attingat
Att,/proiel/cic-att.xml|79032,,dilexi,dilexi enim hominem,3,1,0,hanc quae me hercule mihi magno dolori est dilexi enim hominem procura quantulacumque est Precianam hereditatem prorsus ille ne attingat
Att,/proiel/cic-att.xml|79055,,per,per fortunas,2,0,0,per fortunas
Att,/proiel/cic-att.xml|79059,,age,age,1,0,0,age hoc malum mihi commune est cum omnibus
Att,/proiel/cic-att.xml|225191,,quaeso,quaeso,1,0,0,illud meum proprium  quaeso suscipe
Att,/proiel/cic-att.xml|79076,,amabo,amabo te,2,0,0,exspecta amabo te dum Atticum conveniam
Att,/proiel/cic-att.xml|79418,,hercule,hercule,1,0,0,de reliquo ne que hercule quid agam ne que quid acturus sim scio
Att,/proiel/cic-att.xml|79423,,quaeso,quaeso,1,0,0,tu quaeso crebro ad me scribe vel quod in buccam venerit
Att,/proiel/cic-att.xml|79522,,consulendum,aliter enim mihi de illis ac de me ipso consulendum est,11,1,0,sed velim consideres quid faciendum putes primum    aliter enim mihi de illis ac de me ipso consulendum est deinde ad opiniones ne reprehendamur quod eas Romae velimus esse in communi bonorum fuga 
Att,/proiel/cic-att.xml|79652,,ecce,ecce tibi,2,0,0,ecce tibi iiiNonas Febr inane accepi litteras tuas Philotimi Furni Curionis ad Furnium quibus inridet L Caesaris legationem
Att,/proiel/cic-att.xml|79662,,,qui enim cum ,3,1,0,at illum ruere nuntiant et iam iam que adesse non ut manum conserat qui cum enim sed ut fugam intercludat 
Att,/proiel/cic-att.xml|79683,,rem,o rem miseram et incredibilem,5,0,0,Gnaeus autem noster o rem miseram et incredibilem ut totus iacet
Att,/proiel/cic-att.xml|79709,,sit,recte sit,2,0,0,recte sit censeo cedendum de oppidis iis egeo consili 
Att,/proiel/cic-att.xml|79717,,hortantur,multi enim hortantur,3,1,0,fac posse tuto multi enim hortantur num etiam honeste  
Att,/proiel/cic-att.xml|79722,,sunt,hi enim sunt nobis id est in formiano cum,9,1,0,haec metuo equidem ne sint somnia sed tamen Manlium Lepidum L Torquatum C Cassium tribunum pl hi enim sunt nobis cum id est in Formiano Philotimi litterae ad vitam revocaverunt 
Att,/proiel/cic-att.xml|79724,,rem,o rem acerbam,3,0,0,ego autem illa metuo ne veriora sint nos omnis paene iam captos esse Pompeium Italia cedere quem quidem o rem acerbam persequi Caesar dicitur 
Att,/proiel/cic-att.xml|79743,,ecce,ecce,1,0,0,ecce postridie Cassio litterae Capua a Lucretio familiari eius 
Att,/proiel/cic-att.xml|79754,,erat,ne enim erat difficile que,5,1,0,quid dicam nisi illud eum scisse ne que enim erat difficile hoc nescisse 
Att,/proiel/cic-att.xml|79764,,verbis,at quibus verbis pro tuis rebus gestis amplissimis,8,0,0,plane eum quoi noster alterum consulatum deferret et triumphum at quibus verbis pro tuis rebus gestis amplissimis inimicum habere nolueram
Att,/proiel/cic-att.xml|79849,,scis,et ut esset a me est tu scis propter suspicionem huius impendentis tempestatis multo ante provisum te,17,0,0,qui etsi multis rebus significat se nobis esse amicum et ut esset a me est tu te scis propter suspicionem huius impendentis tempestatis multo ante provisum tamen utrumque considerandum est et quanta fides ei sit habenda et si maxime exploratum sit eum nobis amicum fore sit ne viri fortis et boni civis esse in ea urbe in qua cum summis honoribus imperiis que usus sit res maximas gesserit sacerdotio sit amplissimo praeditus non futurus sit qui fuerit subeundum que periculum sit cum aliquo fore dedecore si quando Pompeius rem publicam reciperarit 
Att,/proiel/cic-att.xml|79852,,addo,addo etiam,2,0,0,nihil actum est a Pompeio nostro sapienter nihil fortiter addo etiam nihil nisi contra consilium auctoritatem que meam   
Att,/proiel/cic-att.xml|79871,,age,age iam,2,0,0,age iam cum fratre an sine eo cum filio  
Att,/proiel/cic-att.xml|79875,,age,age iam,2,0,0,age iam has compedes fascis inquam hos laureatos ecferre ex Italia quam molestum est
Att,/proiel/cic-att.xml|79891,,ecce,ecce,1,0,0,sed ecce nuntii scribente me haec ipsa noctu in Caleno ecce litterae Caesarem ad Corfinium Domitium Corfini cum firmo exercitu et pugnare cupiente      
Att,/proiel/cic-att.xml|79891,,ecce,ecce,1,0,0,sed ecce nuntii scribente me haec ipsa noctu in Caleno ecce litterae Caesarem ad Corfinium Domitium Corfini cum firmo exercitu et pugnare cupiente      
Att,/proiel/cic-att.xml|79901,,hercule,me hercule,2,0,0,Dicaearchum me hercule aut Aristoxenum diceres arcessi non unum hominem omnium loquacissimum et minime aptum ad docendum  
Att,/proiel/cic-att.xml|79956,,hercule,me hercule,2,0,0,quod superest ne c ista videre possum quae numquam timui ne viderem ne c me hercule istum propter quem mihi non modo meis sed me met ipso carendum est
Att,/proiel/cic-att.xml|79962,,ecce,ecce,1,0,0,ecce subito litterae Domiti ad illum ipsius ad consules  
Att,/proiel/cic-att.xml|79976,,ferebat,ita tempus ferebat,3,0,0,ne ego istas litteras in contione recitari velim si quidem ille ipse ad eundem scribens in publico proposuit epistulam illam in qua est pro tuis rebus gestis amplissimis amplioribus ne quam suis quam Africani ita tempus ferebat si quidem etiam vos duo tales ad quintum miliarium quid nunc ipsum de se recipienti quid agenti quid acturo     
Att,/proiel/cic-att.xml|79976,,,amplioribus quam suis ne ,4,0,0,ne ego istas litteras in contione recitari velim si quidem ille ipse ad eundem scribens in publico proposuit epistulam illam in qua est pro tuis rebus gestis amplissimis amplioribus ne quam suis quam Africani ita tempus ferebat si quidem etiam vos duo tales ad quintum miliarium quid nunc ipsum de se recipienti quid agenti quid acturo     
Att,/proiel/cic-att.xml|79976,,,quam africani ,2,0,0,ne ego istas litteras in contione recitari velim si quidem ille ipse ad eundem scribens in publico proposuit epistulam illam in qua est pro tuis rebus gestis amplissimis amplioribus ne quam suis quam Africani ita tempus ferebat si quidem etiam vos duo tales ad quintum miliarium quid nunc ipsum de se recipienti quid agenti quid acturo     
Att,/proiel/cic-att.xml|79986,,συνδιημερεύομεν,fere  quod gratissimum illi est numquam,7,0,0,Lepido quidem nam fere  quod gratissimum illi est numquam placuit ex Italia exire Tullo multo minus  
Att,/proiel/cic-att.xml|79990,,obsecro,obsecro te,2,0,0,sed obsecro te quid hoc miserius quam alterum plausus in foedissima causa quaerere alterum offensiones in optima   
Att,/proiel/cic-att.xml|79992,,hercule,me hercule,2,0,0,et me hercule quamvis amemus Gnaeum nostrum ut et facimus et debemus tamen hoc quod talibus viris non subvenit laudare non possum
Att,/proiel/cic-att.xml|80083,,videbatur,qua mihi nihil utilius videbatur,5,0,0,cum ad te litteras misissem quae tibi Canusi redditae sunt suspicionem nullam habebam te rei publicae causa mare transiturum eram que in spe magna fore ut in Italia possemus aut concordiam constituere qua mihi nihil utilius videbatur aut rem publicam summa cum dignitate defendere
Att,/proiel/cic-att.xml|80089,,subscripseras,earum exemplum subscripseras que,4,0,0,hae scriptae sic erant litteras tibi a L Domitio a d xiii Kal Martias adlatas esse earum que exemplum subscripseras magni que interesse rei publicae scripseras omnis copias primo quoque tempore in unum locum convenire et ut praesidio quod satis esset Capuae relinqueret
Att,/proiel/cic-att.xml|80101,,ostenderas,nam de italia quidem nihil mihi umquam ostenderas,8,0,1,mea quae semper fuerit sententia primum de pace vel iniqua condicione retinenda deinde de urbe nam de Italia quidem nihil mihi umquam ostenderas meminisse te arbitror
Att,/proiel/cic-att.xml|80128,,habebis,habebis autem per quos possis,5,0,0,volo etiam exquiras quam diligentissime poteris habebis autem per quos possis quid Lentulus noster quid Domitius agat quid acturus sit quem ad modum nunc se gerant num quem accusent num quoi suscenseant  
Att,/proiel/cic-att.xml|80190,,est,id est feralibus,3,0,0,eodem enim die video Caesarem a Corfinio post meridiem profectum esse id est Feralibus quo Canusio mane Pompeium 
Att,/proiel/cic-att.xml|80245,,fuerit,quaecumque fortuna eius fuerit,4,0,0,is quaecumque tibi de Caesare dixit quaeque Caesar scripsit scio re tibi probabit quaecumque fortuna eius fuerit verissime scripsisse 
Att,/proiel/cic-att.xml|80253,,optimatibus,quibus optimatibus,2,0,0,quibus optimatibus di boni
off,/proiel/cic-off.xml|86037,,opinor,opinor,1,0,0,Perfectum officium rectum opinor vocemus quoniam Graeci  
off,/proiel/cic-off.xml|86080,,debent,omnes autem velle debent,4,0,0,quod vitium effugere qui volet omnes autem velle debent adhibebit ad considerandas res et tempus et diligentiam
off,/proiel/cic-off.xml|86115,,ést,nlla sancta scietas n fides regni st c,8,0,0,Quod enim est apud Ennium Nlla sancta scietas N c fides regni st id latius patet
off,/proiel/cic-off.xml|86157,,habeo,nihil enim habeo praeter auditum,5,1,0,Ne noster quidem probandus si verum est Quintum Fabium Labeonem seu quem alium nihil enim habeo praeter auditum arbitrum Nolanis et Neapolitanis de finibus a senatu datum cum ad locum venisset cum utrisque separatim locutum ne cupide quid agerent ne appetenter atque ut regredi quam progredi mallent  
off,/proiel/cic-off.xml|86327,,addo,addo etiam utilitatem,3,0,0,Harum rerum duarum splendor omnis amplitudo addo etiam utilitatem in posteriore est causa autem et ratio efficiens magnos viros in priore   
off,/proiel/cic-off.xml|86351,,scio,haud scio an magis etiam ,5,0,0,Capessentibus autem rem publicam nihilo minus quam philosophis haud scio an magis etiam et magnificentia et despicientia adhibenda est rerum humanarum quam saepe dico et tranquillitas animi atque securitas siquidem ne c anxii futuri sunt et cum gravitate constantia que victuri 
off,/proiel/cic-off.xml|86376,,attingit,attingit etiam bellicam quoniam vi manu que confecta est,9,0,0,quamquam haec quidem res non solum ex domestica est ratione attingit etiam bellicam quoniam vi manu que confecta est sed tamen id ipsum est gestum consilio urbano sine exercitu
off,/proiel/cic-off.xml|86528,,sunt,sunt enim quidam homines non re sed nomine,8,1,0,Quin etiam si quis est paulo ad voluptates propensior modo ne sit ex pecudum genere sunt enim quidam homines non re sed nomine sed si quis est paulo erectior quamvis voluptate capiatur occultat et dissimulat appetitum voluptatis propter verecundiam
off,/proiel/cic-off.xml|86535,,videmus,alios videmus velocitate ad cursum alios viribus ad luctandum valere itemque in formis aliis dignitatem inesse aliis venustatem   ,18,0,0,Ut enim in corporibus magnae dissimilitudines sunt alios videmus velocitate ad cursum alios viribus ad luctandum valere itemque in formis aliis dignitatem inesse aliis venustatem sic in animis exsistunt maiores etiam varietates   
off,/proiel/cic-off.xml|86705,,domus,domus ntiqua quam dispari dominre domino,6,0,0,O domus ntiqua heu quam dispari dominre domino quod quidem his temporibus in multis licet dicere
off,/proiel/cic-off.xml|86705,,heu,heu,1,0,0,O domus ntiqua heu quam dispari dominre domino quod quidem his temporibus in multis licet dicere
off,/proiel/cic-off.xml|86705,,licet,quod quidem his temporibus in multis licet dicere,8,0,0,O domus ntiqua heu quam dispari dominre domino quod quidem his temporibus in multis licet dicere
off,/proiel/cic-off.xml|86780,,est,ut est certe,3,0,0,ea si maxima est ut est certe necesse est quod a communitate ducatur officium id esse maximum
off,/proiel/cic-off.xml|86796,,est,id est ex societate generis humani,6,0,0,Itaque nisi ea virtus quae constat ex hominibus tuendis id est ex societate generis humani attingat cognitionem rerum solivaga cognitio et ieiuna videatur item que magnitudo animi remota communitate coniunctione que humana feritas sit quaedam et immanitas
Vul,/proiel/latin-nt.xml|10294,,ecce,ecce,1,0,0,ecce mitto angelum meum ante faciem tuam qui praeparabit viam tuam
Vul,/proiel/latin-nt.xml|10316,,erant,erant enim piscatores,3,1,0,et praeteriens secus mare Galilaeae vidit Simonem et Andream fratrem eius mittentes retia in mare erant enim piscatores et dixit eis Iesus
Vul,/proiel/latin-nt.xml|10379,,dimittuntur,dimittuntur tibi peccata,3,0,0,quid est facilius dicere paralytico dimittuntur tibi peccata an dicere surge et tolle grabattum tuum et ambula
Vul,/proiel/latin-nt.xml|10379,,et,surge et tolle grabattum tuum et ambula,7,0,0,quid est facilius dicere paralytico dimittuntur tibi peccata an dicere surge et tolle grabattum tuum et ambula
Vul,/proiel/latin-nt.xml|10414,,ecce,ecce,1,0,0,ecce quid faciunt sabbatis quod non licet 
Vul,/proiel/latin-nt.xml|10449,,inposuit,et inposuit eis nomina boanerges quod est filii tonitrui,9,0,0,et Iacobum Zebedaei et Iohannem fratrem Iacobi et inposuit eis nomina Boanerges quod est Filii tonitrui et Andream et Philippum et Bartholomeum et Mattheum et Thomam et Iacobum Alphei et Thaddeum et Simonem Cananeum et Iudam Scarioth qui et tradidit illum 
Vul,/proiel/latin-nt.xml|10463,,amen,amen,1,0,0,amen dico vobis quoniam omnia dimittentur filiis hominum peccata et blasphemiae quibus blasphemaverint
Vul,/proiel/latin-nt.xml|10470,,ecce,ecce,1,0,0,ecce mater tua et fratres tui foris quaerunt te
Vul,/proiel/latin-nt.xml|10474,,ecce,ecce,1,0,0,ecce mater mea et fratres mei 
Vul,/proiel/latin-nt.xml|10480,,ecce,ecce,1,0,0,ecce exiit seminans ad seminandum
Vul,/proiel/latin-nt.xml|10646,,factum,manifestum enim factum est nomen eius,6,1,0,et audivit Herodes rex manifestum enim factum est nomen eius et dicebat quia
Vul,/proiel/latin-nt.xml|10711,,erat,erat enim ventus contrarius eis,5,1,0,et videns eos laborantes in remigando erat enim ventus contrarius eis et circa quartam vigiliam noctis venit ad eos ambulans super mare
Vul,/proiel/latin-nt.xml|10727,,est,id est,2,0,0,et cum vidissent quosdam ex discipulis eius communibus manibus id est non lotis manducare panes vituperaverunt
Vul,/proiel/latin-nt.xml|10770,,utique,utique,1,0,0,utique Domine nam et catelli sub mensa comedunt de micis puerorum
Vul,/proiel/latin-nt.xml|10780,,eppheta,eppheta quod est adaperire,4,0,0,eppheta quod est adaperire
Vul,/proiel/latin-nt.xml|10789,,ecce,ecce,1,0,0,quia ecce iam triduo sustinent me ne c habent quod manducent
Vul,/proiel/latin-nt.xml|10809,,amen,amen,1,0,0,amen dico vobis si dabitur generationi isti signum
Vul,/proiel/latin-nt.xml|10869,,amen,amen,1,0,0,amen dico vobis quia sunt quidam de hic stantibus qui non gustabunt mortem donec videant regnum Dei veniens in virtute
Vul,/proiel/latin-nt.xml|10953,,amen,amen,1,0,0,quisquis enim potum dederit vobis calicem aquae in nomine meo quia Christi estis amen dico vobis non perdet mercedem suam
Vul,/proiel/latin-nt.xml|10953,,dico,dico vobis,2,0,0,quisquis enim potum dederit vobis calicem aquae in nomine meo quia Christi estis amen dico vobis non perdet mercedem suam
Vul,/proiel/latin-nt.xml|10993,,amen,amen,1,0,0,amen dico vobis
Vul,/proiel/latin-nt.xml|11021,,ecce,ecce,1,0,0,ecce nos dimisimus omnia et secuti sumus te
Vul,/proiel/latin-nt.xml|11023,,amen,amen,1,0,0,amen dico vobis
Vul,/proiel/latin-nt.xml|11031,,ecce,ecce,1,0,0,quia ecce ascendimus in Hierosolyma et Filius hominis tradetur principibus sacerdotum et scribis et senioribus et damnabunt eum morti et tradent eum gentibus
Vul,/proiel/latin-nt.xml|11070,,rabboni,rabboni,1,0,0,rabboni ut videam 
Vul,/proiel/latin-nt.xml|11077,,facitis,quid facitis ,2,0,0,et si quis vobis dixerit quid  facitis  dicite quia Domino necessarius  est et continuo illum  dimittet huc
Vul,/proiel/latin-nt.xml|11091,,osanna,osanna,1,0,0,osanna
Vul,/proiel/latin-nt.xml|11094,,osanna,osanna in excelsis,3,0,0,osanna in excelsis
Vul,/proiel/latin-nt.xml|11117,,ecce,ecce,1,0,0,rabbi ecce ficus cui  maledixisti aruit
Vul,/proiel/latin-nt.xml|47455,,amen,amen,1,0,0,amen  dico vobis
Vul,/proiel/latin-nt.xml|11238,,amen,amen,1,0,0,amen dico vobis quoniam vidua haec pauper plus omnibus misit qui miserunt in gazofilacium
Vul,/proiel/latin-nt.xml|11268,,intellegat,qui legit intellegat,3,0,0,cum autem videritis abominationem desolationis stantem ubi non debet qui legit intellegat tunc qui in Iudaea sunt fugiant in montes
Vul,/proiel/latin-nt.xml|11272,,vae,vae autem praegnatibus et nutrientibus in illis diebus,8,0,0,vae autem praegnatibus et nutrientibus in illis diebus
Vul,/proiel/latin-nt.xml|11277,,ecce,ecce,1,0,0,et tunc si quis vobis dixerit ecce hic est Christus ecce illic ne credideritis 
