WORK,SENT.ADDR,PARENTH,SENT
Pere,/proiel/per-aeth.xml|57919,id est,Septima autem septimana cum uenerit id est quando iam due superant cum ipsa ut pascha sit singulis diebus omnia quidem sic aguntur sicut et ceteris septimanis quae transierunt tantum modo quod uigiliae quae in illis sex septimanis in Anastase factae sunt 
Pere,/proiel/per-aeth.xml|57920,id est,Septima autem septimana id est sexta feria in Syon fiunt uigiliae iuxta consuetudinem eam qua in Anastase factae sunt per sex septimanas
Pere,/proiel/per-aeth.xml|57926,id est,Lazarium autem id est Bethania est forsitan secundo miliario a ciuitate
Pere,/proiel/per-aeth.xml|57932,id est,Iam autem ut fiat missa denuntiatur pascha id est subit presbyter in altiori loco et  leget illum locum qui scriptus est in euangelio Cum uenisset Iesus in Bethania ante sex dies paschae et cetera
Pere,/proiel/per-aeth.xml|57937,id est,Alia ergo die id est dominica qua intratur in septimana paschale quam hic  appellant septimana maior celebratis de pullorum cantu his quae consuetudinis sunt in Anastase uel ad Crucem usque ad mane agi die ergo dominica mane proceditur iuxta consuetudinem in ecclesia maiore quae appellatur Martyrium
Pere,/proiel/per-aeth.xml|57939,id est,Propterea autem Martyrium  appellatur quia in Golgotha est id est post Crucem ubi Dominus passus est et ideo Martyrio 
Pere,/proiel/per-aeth.xml|57941,id est,Ista septimana omne id est de die crastino hora nona omnes ad Martyrium conueniamus id est in ecclesia maiore
Pere,/proiel/per-aeth.xml|57941,id est,Ista septimana omne id est de die crastino hora nona omnes ad Martyrium conueniamus id est in ecclesia maiore
Pere,/proiel/per-aeth.xml|57944,id est,Facta ergo missa in ecclesia maiore id est ad Martyrium deducitur episcopus cum ymnis ad Anastase et ibi completis quae consuetudo est diebus dominicis fieri in Anastase post missa Martyrii et iam unusquisque hiens ad domum suam festinat manducare ut hora inquoante septima omnes in ecclesia parati sint quae est in Eleona id est in monte Oliueti ubi est spelunca illa in qua docebat Dominus
Pere,/proiel/per-aeth.xml|57944,id est,Facta ergo missa in ecclesia maiore id est ad Martyrium deducitur episcopus cum ymnis ad Anastase et ibi completis quae consuetudo est diebus dominicis fieri in Anastase post missa Martyrii et iam unusquisque hiens ad domum suam festinat manducare ut hora inquoante septima omnes in ecclesia parati sint quae est in Eleona id est in monte Oliueti ubi est spelunca illa in qua docebat Dominus
Pere,/proiel/per-aeth.xml|57945,id est,Hora ergo septima omnis populus ascendet in monte Oliueti id est in Eleona in ecclesia sed et episcopus
Pere,/proiel/per-aeth.xml|57946,id est,Et cum ceperit se facere hora nona subitur cum ymnis in Inbomon id est in eo loco de quo ascendit Dominus in caelis et ibi seditur
Pere,/proiel/per-aeth.xml|57957,id est,Item alia die id est secunda feria aguntur quae consuetudinis sunt de pullo primo agi usque ad mane ad Anastase
Pere,/proiel/per-aeth.xml|57958,id est,Ad nona autem omnes in ecclesia maiore id est ad Martyrium colligent se et ibi usque ad horam primam noctis semper ymni et antiphonae dicuntur
Pere,/proiel/per-aeth.xml|57964,id est,In qua ecclesia cum uentum fuerit intrat episcopus intra spelunca in qua spelunca solebat Dominus docere discipulos et accipit codicem euangelii et stans ipse episcopus leget uerba Domini quae scripta sunt in euangelio in cata Mattheo id est ubi  dicit
Pere,/proiel/per-aeth.xml|57983,Et accessit quantum iactus lapidis  ,Ac sic ergo cum ceperit esse pullorum cantus descenditur de Imbomon cum ymnis et acceditur eodem loco ubi orauit Dominus sicut scriptum est in euangelio Et  accessit quantum iactus lapidis et  orauit et cetera 
Pere,/proiel/per-aeth.xml|57983,orauit ,Ac sic ergo cum ceperit esse pullorum cantus descenditur de Imbomon cum ymnis et acceditur eodem loco ubi orauit Dominus sicut scriptum est in euangelio Et  accessit quantum iactus lapidis et  orauit et cetera 
Pere,/proiel/per-aeth.xml|58000,id est,De hora enim sexta denuo necesse  habemus hic omnes conuenire in isto loco id est ante Crucem ut lectionibus et orationibus usque ad noctem operam  demus
Pere,/proiel/per-aeth.xml|58001,id est,Post hoc ergo missa facta de Cruce id est antequam sol procedat statim unusquisque animosi uadent in Syon orare ad columnam illam ad quem flagellatus est Dominus
Pere,/proiel/per-aeth.xml|58006,nescio quando  ,Et quoniam  nescio quando dicitur quidam fixisse morsum et  furasse de sancto ligno ideo nunc a diaconibus qui in giro stant sic  custoditur ne qui ueniens audeat denuo sic facere 
Pere,/proiel/per-aeth.xml|64281,id est,usque ad horam sextam omnis populus transit per unum ostium intrans per alterum perexiens quoniam hoc in eo loco fit in quo pridie id est quinta feria oblatio facta est 
Pere,/proiel/per-aeth.xml|58010,id est,At ubi autem sexta hora se fecerit sic itur ante Crucem si ue pluuia siue estus sit quia ipse locus subdiuanus est id est quasi atrium ualde grandem et pulchrum satis quod est inter Cruce et Anastase
Pere,/proiel/per-aeth.xml|58013,id est,id est ita legitur primum de psalmis ubicumque de passione  dixit
Pere,/proiel/per-aeth.xml|59998,id est,clerici autem uigilant ibi id est qui aut fortiores sunt aut iuueniores et tota nocte dicuntur ibi ymni et antiphonae usque ad mane
Pere,/proiel/per-aeth.xml|60003,id est,ad nonam autem iam non fit sabbato sed parantur uigiliae paschales in ecclesia maiore id est in Martyrium
Pere,/proiel/per-aeth.xml|58035,id est,Proceditur autem ipsa die dominica prima in ecclesia maiore id est ad Martyrium et secunda feria et tertia feria ubi ita tamen ut semper missa facta de Martyrio ad Anastase ueniatur cum ymnis 
Pere,/proiel/per-aeth.xml|60043,id est,dominica autem die id est octauis denuo in ecclesia maiore id est ad Martyrium 
Pere,/proiel/per-aeth.xml|60043,id est,dominica autem die id est octauis denuo in ecclesia maiore id est ad Martyrium 
Pere,/proiel/per-aeth.xml|58037,id est,Ipsis autem octo diebus paschalibus cotidie post prandium episcopus cum omni clero et omnibus infantibus id est qui baptidiati fuerint et omnibus qui aputactitae sunt uiri ac feminae ne c non etiam et de plebe quanti uolunt in Eleona ascendent
Pere,/proiel/per-aeth.xml|64293,id est,fiunt orationes tam in ecclesia quae in Eleona est in qua est spelunca in qua docebat Iesus discipulos tam etiam in Imbomon id est in eo loco de quo Dominus ascendit in caelis 
Pere,/proiel/per-aeth.xml|58041,id est,Sane dominica die per pascha post missa lucernarii id est de Anastase omnis populus episcopum cum ymnis in Syon ducet
Pere,/proiel/per-aeth.xml|60064,id est,id est quando tunc unus ex discipulis ibi non erat id est Thomas qua reuersus est et dicentibus ei aliis apostolis quia Dominum uidissent ille dixit
Pere,/proiel/per-aeth.xml|60064,id est,id est quando tunc unus ex discipulis ibi non erat id est Thomas qua reuersus est et dicentibus ei aliis apostolis quia Dominum uidissent ille dixit
Pere,/proiel/per-aeth.xml|58045,id est,Item octauis paschae id est die dominica statim post sexta omnis populus cum episcopo ad Eleona ascendit
Pere,/proiel/per-aeth.xml|58052,id est,A pascha autem usque ad quinquagesima id est pentecosten hic penitus nemo ieiunat nec ipsi aputactitae qui sunt
Pere,/proiel/per-aeth.xml|58054,id est,Dominicis autem diebus semper in Martyrio id est in ecclesia maiore proceditur iuxta consuetudinem et inde itur ad Anastase cum ymnis
Pere,/proiel/per-aeth.xml|58056,id est,Die autem quadragesimarum post pascha id est quinta feria pridie omnes post sexta id est quarta feria in Bethleem uadunt propter uigilias celebrandas Fiunt autem uigiliae in ecclesia in Bethleem in qua ecclesia spelunca est ubi natus est Dominus Alia die autem id est quinta feria quadragesimarum celebratur missa ordine suo ita ut et presbyteri et episcopus praedicent dicentes apte diei et loco et postmodum sera reuertuntur unusquisque in Ierusolima
Pere,/proiel/per-aeth.xml|58056,id est,Die autem quadragesimarum post pascha id est quinta feria pridie omnes post sexta id est quarta feria in Bethleem uadunt propter uigilias celebrandas Fiunt autem uigiliae in ecclesia in Bethleem in qua ecclesia spelunca est ubi natus est Dominus Alia die autem id est quinta feria quadragesimarum celebratur missa ordine suo ita ut et presbyteri et episcopus praedicent dicentes apte diei et loco et postmodum sera reuertuntur unusquisque in Ierusolima
Pere,/proiel/per-aeth.xml|58056,pridie omnes post sexta quarta feria in Bethleem uadunt propter uigilias celebrandas,Die autem quadragesimarum post pascha id est quinta feria pridie omnes post sexta id est quarta feria in Bethleem uadunt propter uigilias celebrandas Fiunt autem uigiliae in ecclesia in Bethleem in qua ecclesia spelunca est ubi natus est Dominus Alia die autem id est quinta feria quadragesimarum celebratur missa ordine suo ita ut et presbyteri et episcopus praedicent dicentes apte diei et loco et postmodum sera reuertuntur unusquisque in Ierusolima
Pere,/proiel/per-aeth.xml|58056,Fiunt autem uigiliae in ecclesia in Bethleem in qua ecclesia spelunca est ubi natus est Dominus,Die autem quadragesimarum post pascha id est quinta feria pridie omnes post sexta id est quarta feria in Bethleem uadunt propter uigilias celebrandas Fiunt autem uigiliae in ecclesia in Bethleem in qua ecclesia spelunca est ubi natus est Dominus Alia die autem id est quinta feria quadragesimarum celebratur missa ordine suo ita ut et presbyteri et episcopus praedicent dicentes apte diei et loco et postmodum sera reuertuntur unusquisque in Ierusolima
Pere,/proiel/per-aeth.xml|58056,id est,Die autem quadragesimarum post pascha id est quinta feria pridie omnes post sexta id est quarta feria in Bethleem uadunt propter uigilias celebrandas Fiunt autem uigiliae in ecclesia in Bethleem in qua ecclesia spelunca est ubi natus est Dominus Alia die autem id est quinta feria quadragesimarum celebratur missa ordine suo ita ut et presbyteri et episcopus praedicent dicentes apte diei et loco et postmodum sera reuertuntur unusquisque in Ierusolima
Pere,/proiel/per-aeth.xml|58059,id est,Quinquagesimarum autem die id est dominica qua die maximus labor est populo aguntur omnia sic de pullo quidem primo iuxta consuetudinem
Pere,/proiel/per-aeth.xml|58060,id est,uigilatur in Anastase ut legat episcopus locum illum euangelii qui semper dominica die legitur id est resurrectionem Domini et postmodum sic ea aguntur in Anastase quae consuetudinaria sunt sicut toto anno
Pere,/proiel/per-aeth.xml|58061,id est,Cum autem mane factum fuerit procedit omnis populus in ecclesia maiore id est ad Martyrium
Pere,/proiel/per-aeth.xml|64315,id est,aguntur omnia legitima id est offertur iuxta consuetudinem qua dominica die consueuit fieri sed eadem adceleratur missa in Martyrium ut ante hora tertia fiat
Pere,/proiel/per-aeth.xml|58064,alia modo ecclesia est,Nam presbyteri de hoc ipsud quod lectum est quia ipse est locus in Syon alia modo ecclesia est ubi quondam post passionem Domini collecta erat multitudo cum apostolis qua hoc factum est ut superius  diximus legunt ibi de actibus apostolorum 
Pere,/proiel/per-aeth.xml|58064,ut superius diximus ,Nam presbyteri de hoc ipsud quod lectum est quia ipse est locus in Syon alia modo ecclesia est ubi quondam post passionem Domini collecta erat multitudo cum apostolis qua hoc factum est ut superius  diximus legunt ibi de actibus apostolorum 
Pere,/proiel/per-aeth.xml|58067,id est,Reuertitur ergo omnis populus unusquisque in domum suam resumere se et statim post prandium ascenditur mons Oliueti id est in Eleona unusquisque quomodo  potest ita ut nullus Christianorum remaneat in ciuitate qui non omnes uadent  
Pere,/proiel/per-aeth.xml|58068,id est,Quemadmodum ergo subitum fuerit in monte Oliueti id est in Eleona primum itur in Imbomon id est in eo loco unde ascendit Dominus in caelis et ibi sedet episcopus et presbyteri sedet omnis populus leguntur ibi lectiones dicuntur interpositi ymni dicuntur et antiphonae aptae diei ipsi et loco orationes etiam quae interponuntur semper tales pronuntiationes habent ut et diei et loco conueniunt
Pere,/proiel/per-aeth.xml|58068,id est,Quemadmodum ergo subitum fuerit in monte Oliueti id est in Eleona primum itur in Imbomon id est in eo loco unde ascendit Dominus in caelis et ibi sedet episcopus et presbyteri sedet omnis populus leguntur ibi lectiones dicuntur interpositi ymni dicuntur et antiphonae aptae diei ipsi et loco orationes etiam quae interponuntur semper tales pronuntiationes habent ut et diei et loco conueniunt
Pere,/proiel/per-aeth.xml|58070,id est,Cum autem hoc factum fuerit benedicuntur cathecumini sic fideles et hora iam nona descenditur inde et cum ymnis itur ad illam ecclesiam quae et ipsa in Eleona est id est in qua spelunca sedens docebat Dominus apostolos 
Pere,/proiel/per-aeth.xml|58074,id est,De porta autem quoniam satis est usque ad ecclesia maiore id est ad Martirium porro hora noctis forsitan secunda peruenitur quia lente et lente itur totum pro populo ne fatigentur pedibus
Pere,/proiel/per-aeth.xml|58083,id est,Etiam postmodum ceteris diebus ita singula aguntur ut toto anno id est ut semper de pullo primo ad Anastase uigiletur
Pere,/proiel/per-aeth.xml|58091,id est,Cum autem annotauerit omnium nomina presbyter postmodum alia die de quadragesimis id est qua inchoantur octo ebdomadae ponitur episcopo cathedra media ecclesia maiore id est ad Martyrium sedent hinc et inde presbyteri in cathedris et stant clerici omnes
Pere,/proiel/per-aeth.xml|58091,id est,Cum autem annotauerit omnium nomina presbyter postmodum alia die de quadragesimis id est qua inchoantur octo ebdomadae ponitur episcopo cathedra media ecclesia maiore id est ad Martyrium sedent hinc et inde presbyteri in cathedris et stant clerici omnes
Pere,/proiel/per-aeth.xml|58104,id est,Cathecuminus autem ibi non intrat tunc qua episcopus docet illos legem id est sic
Pere,/proiel/per-aeth.xml|58108,id est,Ac sic est ut in hisdem locis omnes fideles sequantur scripturas quando  leguntur in ecclesia quia omnes docentur per illos dies quadraginta id est ab hora prima usque ad horam tertiam quoniam per tres horas fit cathecisin
Pere,/proiel/per-aeth.xml|58111,id est,Octaua enim septimana quadragesimarum id est quae appellatur septimana maior iam non uacat eos doceri ut impleantur ea quae superius dicta sunt
Pere,/proiel/per-aeth.xml|58116,id est,uerba autem quae sunt misterii altioris id est ipsius baptismi quia adhuc cathecumini estis audire non  potestis
Pere,/proiel/per-aeth.xml|58119,id est,Post autem uenerint dies paschae per illos octo dies id est a pascha usque ad octauas quemadmodum missa facta fuerit de ecclesia et itur cum ymnis ad Anastase mox fit oratio benedicuntur fideles et stat episcopus incumbens in cancello interiore qui est in spelunca Anastasis et  exponet omnia quae aguntur in baptismo 
Pere,/proiel/per-aeth.xml|58127,id est,Sane quicumque hic latini sunt id est qui ne c siriste ne c grece nouerunt ne  contristentur et ipsis exponitur eis quia sunt alii fratres et sorores grecolatini qui latine exponunt eis
Pere,/proiel/per-aeth.xml|58129,id est,Item dies enceniarum appellantur quando sancta ecclesia quae in Golgotha est quam Martyrium  uocant consecrata est Deo sed et sancta ecclesia quae est ad Anastase id est in eo loco ubi Dominus resurrexit post passionem ea die et ipsa consecrata est Deo
Pere,/proiel/per-aeth.xml|58134,id est,Nam ante plurimos dies incipiunt se undique colligere turbae non solum monachorum uel aputactitum de diuersis prouinciis id est tam de Mesopotamia uel Syria uel de Egypto aut Thebaida ubi plurimi monazontes sunt sed et de diuersis omnibus locis uel prouinciis
Pere,/proiel/per-aeth.xml|58140,id est,Item tertia die in Eleona id est in ecclesia quae est in ipso monte a quo ascendit Dominus in caelis post passionem intra qua ecclesia est spelunca illa in qua docebat Dominus apostolos in monte Oliueti 